{
  "prompt": "Which one is the Porsche 911?",
  "image": {
    "asset": "images/cars/porsche-911-rear.jpg",
    "alt": "Rear three-quarter view of a silver sports car with a sloping roofline.",
    "license": "cc-by-4"
  },
  "options": [
    {
      "id": "a",
      "text": "Porsche 911"
    },
    {
      "id": "b",
      "text": "Chevrolet Corvette"
    },
    {
      "id": "c",
      "text": "Audi TT"
    }
  ],
  "correctOptionId": "a",
  "explanation": {
    "correct": "The sloping fastback roofline and rear-engine proportions are the 911 signature.",
    "incorrect": "Look at the rear-engine, sloping roofline: that is the 911."
  },
  "cues": [
    "Round headlights",
    "Sloping fastback roof"
  ]
}
